{
  "month": "2026-06",
  "generated_at": "2026-06-05T10:15:00-03:00",
  "total_tokens": 438500,
  "total_cost_usd": 0.63825,
  "total_cost_brl": 4.46775,
  "budget_alert": false,
  "by_agent": {
    "antigravity": {
      "tokens": 438500,
      "cost_usd": 0.63825,
      "os_count": 3
    }
  },
  "by_model": {
    "gemini-3.5-flash": {
      "tokens": 25000,
      "cost_usd": 0.00325
    },
    "gemini-1.5-pro": {
      "tokens": 413500,
      "cost_usd": 0.635
    }
  },
  "by_os": [
    {
      "os_id": "OS-MADLAB-TS-STABILIZATION-20260601-001",
      "total_tokens": 25000,
      "total_cost_usd": 0.00325,
      "steps": 1,
      "note": "TypeScript compilation errors resolved"
    },
    {
      "os_id": "OS-MADLAB-OS017-20260604-001",
      "total_tokens": 295000,
      "total_cost_usd": 0.425,
      "steps": 1,
      "note": "Generalization heuristics and authority flow implemented"
    },
    {
      "os_id": "OS-MADLAB-OS018-20260604-001",
      "total_tokens": 118500,
      "total_cost_usd": 0.210,
      "steps": 2,
      "note": "BuildPlanResolver and StoriesBuilderGate implementation & verification"
    }
  ],
  "top_cost_steps": [
    {
      "entry_id": "OS-MADLAB-OS017-20260604-001-step-1",
      "cost_usd": 0.425
    },
    {
      "entry_id": "OS-MADLAB-OS018-20260604-001-step-3",
      "cost_usd": 0.1275
    },
    {
      "entry_id": "OS-MADLAB-OS018-20260604-001-step-2",
      "cost_usd": 0.0825
    },
    {
      "entry_id": "OS-MADLAB-TS-STABILIZATION-20260601-001-step-1",
      "cost_usd": 0.00325
    }
  ],
  "optimization_notes": []
}
